{
  "action_intent_id": null,
  "artifact_id": "F03-0001-TRANSITION-RECEIPT-VERIFICATION",
  "byte_size": 3131,
  "content_hash": "sha256:c8c2079d69f94c51ea496035237674fa0587a9d42587ee6bc574c11975c21b84",
  "created_at": "2026-07-29T02:45:00Z",
  "created_by": {
    "actor_id": "SVC-FOUNDRY-KERNEL-F03",
    "actor_type": "service"
  },
  "locator": "artifacts/work_packages/F03/attempts/0001/transition-receipt-verification.json",
  "media_type": "application/json",
  "receipt_hash": "sha256:158828d9dad99492ca00c27f3c1702e4b614092e979d0114b4253ad71c14aa44",
  "receipt_id": "AR-F03-0001-TRANSITION-RECEIPT-VERIFICATION",
  "schema_ref": null,
  "validation_results": [
    {
      "check": "transition_receipt_test",
      "details": "15/15 F03 tests",
      "status": "PASS"
    },
    {
      "check": "override_provenance_test",
      "details": "6/6 F03 tests",
      "status": "PASS"
    },
    {
      "check": "combined_f01_f02_f03",
      "details": "68/68 targeted Node tests",
      "status": "PASS"
    },
    {
      "check": "full_python_regression",
      "details": "947/947",
      "status": "PASS"
    }
  ]
}
