{
  "action_intent_id": null,
  "artifact_id": "ART-B04-0010-CANONICAL-PROJECTION",
  "byte_size": 64098,
  "content_hash": "sha256:d08d78c19d39e08ec98df3ac4da8014f61fcc19fe0f833f9e5273059c5cda27c",
  "created_at": "2026-07-31T11:30:00.000Z",
  "created_by": {
    "actor_id": "B04-0010-final-packaging-verifier",
    "actor_type": "tool"
  },
  "locator": "src/epistemic_foundry/_canonical/canonical-registry.json",
  "media_type": "application/vnd.epistemic-foundry.canonical-registry+json",
  "receipt_hash": "sha256:a8941d7d5bca4091d88a1fe279c315296a347724b129fb0548c03d349d84bbd1",
  "receipt_id": "AR-B04-0010-CANONICAL-PROJECTION",
  "schema_ref": null,
  "validation_results": [
    {
      "check": "registry_byte_integrity",
      "details": "The receipt binds the exact deterministic 127-schema registry bytes.",
      "status": "PASS"
    },
    {
      "check": "root_snapshot_wheel_convergence",
      "details": "All 128 resources converge byte-for-byte from root authority through the installed wheel.",
      "status": "PASS"
    },
    {
      "check": "post_c04_final_gate",
      "details": "The projection is revalidated after sealed C04-0004 PASS.",
      "status": "PASS"
    }
  ]
}
